{
  "schema_version": "0.3.0-beta",
  "research_question": "获取中国 2019 至 2021 年年度居民消费价格指数。",
  "research_use": "panel_analysis",
  "concepts": [
    {
      "concept": "居民消费价格指数",
      "role": "outcome",
      "definition_constraints": ["Consumer price index"]
    }
  ],
  "indicators": [
    {
      "name_or_code": "FP.CPI.TOTL",
      "required_definition": "Consumer price index"
    }
  ],
  "entities": [
    {
      "name_or_code": "CHN",
      "entity_type": "country",
      "code_scheme": "ISO-3166-1-alpha-3"
    }
  ],
  "time_range": {
    "start": "2019",
    "end": "2021"
  },
  "frequency": "A",
  "unit": null,
  "seasonal_adjustment": "source_native",
  "price_basis": {
    "type": "index",
    "base_period": null,
    "chain_linked": null
  },
  "currency": null,
  "release_or_vintage": {
    "mode": "latest",
    "value": null
  },
  "preferred_sources": ["datapro", "world_bank"],
  "fallback_policy": {
    "mode": "allow_official_missing_only",
    "allowed_sources": ["world_bank"],
    "completion_scope": "missing_cells_only",
    "preserve_datapro_observations": true,
    "replace_primary_observations": false,
    "allow_semantic_substitute": false,
    "allow_cross_source_stitching": false,
    "identity_match_policy": "exact_native_or_approved_mapping",
    "overlap_policy": "validate_without_replacement"
  },
  "transformation_policy": {
    "allow_unit_scaling": false,
    "allow_currency_conversion": false,
    "allow_downsampling": false,
    "allow_upsampling": false,
    "allow_imputation": false,
    "allow_self_seasonal_adjustment": false,
    "allow_rebasing": false,
    "requested_transformations": []
  },
  "output_format": ["csv", "parquet", "json"],
  "native_source_constraints": [
    {
      "source_system": "WORLD_BANK",
      "dataset_name": "World Development Indicators",
      "indicator_code": "FP.CPI.TOTL"
    }
  ]
}
